specimen - institute;specimen - collection;specimen - code;mission - id;mission - originalID;specimen - family;specimen - genus;specimen - specific_epithet;unusable - cause;country - country;country - growned_plant;country - guessed;country - not_sure;country - no_info;region1 - region;region1 - guessed;region1 - not_sure;region1 - no_info;collect_date - collect_date;collect_date - not_sure;collect_date - no_info;onecollector - collector;onecollector - not_sure;onecollector - no_info;collect_number - ;collect_number - no_info;identifier - identifier;identifier - not_sure;identifier - no_info;owner - question_1;owner - no_info;locality - locality;locality - not_sure;locality - no_info;geo - position;geo - radius;geo - description;geo - not_sure;geo - no_info
B;Herbarium Berolinense;B101023331;8;8746725;ARAUCARIACEAE;Araucaria;cunninghamii;;Australien;;;;False;Queensland;;;False;25/11/1958 - 25/11/1958;;;H. u. E. Walter;;;2427;;S. T. Blake;;;H. u. E. Walter;;Yarraman. Aufforstung;;False;-26.830818800678003 , 151.9673538208008;;;;
B;Herbarium Berolinense;B101023332;8;8746725;ARAUCARIACEAE;Araucaria;cunninghamii;;Australien;;;;False;Queensland;;;False;04/12/1958 - 04/12/1958;;;H. u. E. Walter;;;2669;;S. T. Blake;;;H. u. E. Walter;;Imbil. Staatswald, Regenwald;;False;-26.44884835 , 152.62330116752486;;;;
B;Herbarium Berolinense;B101023333;8;8746725;ARAUCARIACEAE;Araucaria;cunninghamii;;Neukaledonien;True;;;False;(Nouvelle-Calédonie);;;False;08/02/1948 - 08/02/1948;False;False;J. T. Buchholz;;False;1665;False;;;True;;True;Vao [Ile des Pins], behind mission.;False;;-22.669035 , 167.495882;;;;False
B;Herbarium Berolinense;B101023334;8;8746725;ARAUCARIACEAE;Araucaria;cunninghamii;;Papua-Neuguinea;False;;;;Oro;;;;10/03/1936 - 10/03/1936;;;C. E. Carr;;False;16019;False;;;True;;True;Papua. Isuarava [Isurava]. Forest, c. 4000 feet;False;False;-9.002106558542621 , 147.73562733573058;;;;False
B;Herbarium Berolinense;B101023335;8;8746725;ARAUCARIACEAE;Araucaria;cunninghamii;;Australien;;;;False;Queensland;;;False;;;True;Kaspiew;;;542;;;;True;;True;Qld.;;False;;;;;True
B;Herbarium Berolinense;B101023336;8;8746725;ARAUCARIACEAE;Araucaria;cunninghamii;;Australien;;;;False;Queensland;;;False;22/06/1965 - 22/06/1965;;;;;True;;True;;;True;;True;S.O.-Queensland, Regenwälder bei Imbil 500 ft. ü M.;;False;-26.5 , 152.66666666666666;;;;
B;Herbarium Berolinense;B101023337;8;8746725;ARAUCARIACEAE;Araucaria;cunninghamii;;Deutschland;True;;;False;Berlin;;;False;18/05/1869 - 18/05/1869;;;Golenz;;;;True;;;True;Bothe;;Berlin, botan. Garten, angepflanzt. Heimat: Ostaustralien;;False;;;;;True
B;Herbarium Berolinense;B101023338;8;8746725;ARAUCARIACEAE;Araucaria;cunninghamii;;Deutschland;True;;;False;Berlin;;;False;18/05/1869 - 18/05/1869;;;Golenz;;;;True;;;True;Bothe;;Berlin: Botanischer Garten, gepflanzt. Heimat: Ostaustralien;;False;;;;;True
B;Herbarium Berolinense;B101023339;8;8746725;ARAUCARIACEAE;Araucaria;cunninghamii;;Schweiz;True;;;False;Luzern(Lucerne);;;False;11/05/1905 - 11/05/1905;;;C. Baenitz;;;;True;;;True;C. Baenitz,Bothe;;"Luzern; in den Gewächshäusern der Villa Wilhelma, 450 m.";;False;47.055878050000004 , 8.303396764094513;;;;
B;Herbarium Berolinense;B101023340;8;8746725;ARAUCARIACEAE;Araucaria;excelsa;;Polen;True;;;;Dolnośląskie;;;;23/09/1905 - 23/09/1905;;;C. Lauterbach;;False;;True;;;True;C. Baenitz,Bothe;;"Breslau; Stabelwitz; in meinen Gewächshäusern. 120 m. Heimisch in Australien.";False;;51.154467 , 16.883862;;;;
B;Herbarium Berolinense;B101023341;8;8746725;ARAUCARIACEAE;Araucaria;excelsa;;Polen;True;;;False;Dolnośląskie;;;False;08/09/1887 - 05/05/1888;;;;;True;;True;;;True;;True;bot. Garten in Breslau;;False;;;;;True
B;Herbarium Berolinense;B101023342;8;8746725;ARAUCARIACEAE;Araucaria;hunsteinii;;Papua-Neuguinea;False;;;;Morobe;;;False;;;True;Biro;;False;;True;;;True;;True;hinter Sanbang[?] Kaiser Wilhelmsland;False;;-6.609595 , 147.58818;;;;
B;Herbarium Berolinense;B101023343;8;8746725;ARAUCARIACEAE;Araucaria;muelleri;;Neukaledonien;False;;;;(Nouvelle-Calédonie);;;;15/10/1947 - 15/10/1947;False;False;J. T. Buchholz;;False;1208s;False;;;True;;True;Beneath trees of No. 1207. Plateau Montagne les Sources along trail toward site of proposed sanatorium. Elevation 850 m.;False;;-22.149921 , 166.558075;;;;False
B;Herbarium Berolinense;B101023344;8;8746725;ARAUCARIACEAE;Araucaria;rulei;;Neukaledonien;False;;;;(Nouvelle-Calédonie);;;;13/08/1965 - 13/08/1965;False;False;Luciano Bernardi;;False;10147;False;;;True;;True;In vallicula uda rivuli montani, ubi nemus ab incendiis incolume, manet. 900-950 m. Forêt Plate, in vicinioribus praedii, vel ad  montem Paéoua metalliferum;False;;-21.166666666666668 , 165.11666666666667;;;;False
B;Herbarium Berolinense;B101023345;8;8746725;ARAUCARIACEAE;Araucaria;rulei;;Neukaledonien;False;;;;(Nouvelle-Calédonie);;;;13/08/1965 - 13/08/1965;False;False;Luciano Bernardi;;False;10147;False;;;True;;True;In vallicula uda rivuli montani, ubi nemus ab incendiis incolume, manet. 900-950 m. Forêt Plate, in vicinioribus praedii (A), vel ad montem Paéoua metalliferum (B);False;;-21.16408329676693 , 165.0268363952637;;;;False
B;Herbarium Berolinense;B101023346;8;8746725;ARAUCARIACEAE;Araucaria;sp.;;Portugal;True;;;False;Madeira;;;False;02/04/1970 - 02/04/1970;;;;;True;;True;;;True;W. Schwabe;;Insel Madeira: Funchal/ Bot. Garten;;False;;;;;True
B;Herbarium Berolinense;B101023347;8;8746725;ARAUCARIACEAE;Araucaria;sp.;;Nepal;;;;False;;;;True;01/04/1980 - 30/04/1980;False;False;;;True;;True;;;True;W. Schwabe;;Zentral-Nepal;;False;;;;;True
B;Herbarium Berolinense;B101023348;8;8746725;ARAUCARIACEAE;Araucaria;sp.;;Malaysia;True;;;;Pulau Pinang;;;False;21/04/1991 - 21/04/1991;False;False;Ralf Jahn;;False;;True;Ralf Jahn;;False;;True;Forest Reserve S Telok Bahang, Höhe 70 m. Forstbaum;False;;5.4241362036187795 , 100.21158814430237;;;;False
B;Herbarium Berolinense;B101023349;8;8746725;ARAUCARIACEAE;Araucaria;sp.;;Papua-Neuguinea;;;;False;Sandaun;;;False;29/08/1961 - 29/08/1961;;;P. J. Darbyshire;;;301;;H. Ern;;False;;True;"New Guinea, near Miwaute village (Torricelli Mts.), Lumi Subdistrict, Sepik District, , in tall forest on side of mountain; alt. ca. 3500 feet.";;False;-3.41849 , 142.1092;;;;
B;Herbarium Berolinense;B101023350;8;8746725;ARAUCARIACEAE;Wollemia;nobilis;;Australien;True;;;;New South Wales;;;;;;True;;;True;;True;;;True;;True;Royal Botanic Gardens Sydney;False;;;;;;True
B;Herbarium Berolinense;B100012394;8;8746725;CEPHALOTAXACEAE;CEPHALOTAXACEAE;sp.;;Türkei;;;;False;İstanbul;;;False;01/06/1844 - 30/06/1844;;;Noë;;;199;;;;True;;True;Constantinopel, auf Feldrainen.;;False;41.0091982 , 28.9662187;;;;
B;Herbarium Berolinense;B100049710;8;8746725;CEPHALOTAXACEAE;CEPHALOTAXACEAE;sp.;;Australien;False;;;;Northern Territory;;;;12/10/2001 - 12/10/2001;False;False;Hope, A. M. & Dixon, D. J.;;;14;False;;;True;;True;4.4 km from Dundee Beach on Cox Peninsula Road;False;;-12.705990173071863 , 130.39947509765628;;;;False
B;Herbarium Berolinense;B100052422;8;8746725;CEPHALOTAXACEAE;CEPHALOTAXACEAE;sp.;;Indien;;;;False;Karnataka;;;False;01/04/1974 - 30/04/1974;;;E. Bolay;;;;True;;;True;;True;Bangalore;;False;12.9767936 , 77.590082;;;;
B;Herbarium Berolinense;B100067589;8;8746725;CEPHALOTAXACEAE;CEPHALOTAXACEAE;sp.;;Spanien;False;;;;Jaén;;;;03/07/1983 - 03/07/1983;False;False;C. Fernández;;False;282, 316;False;C. Fernández;;;;True;Jaén. Peñas de Castro, a 800 m. (30S VG 3075). Matorral sobre calizas.;;False;37.729894 , -3.794466;;;;False
B;Herbarium Berolinense;B100069915;8;8746725;CEPHALOTAXACEAE;CEPHALOTAXACEAE;sp.;;Schweiz;;;;False;Wallis(Valais);;;False;30/07/1975 - 30/07/1975;;;Werner Greuter;;;13039;;;;True;;True;"Commune de Bourg-Saint-Pierre: colline de la station-laboratoire ""La Linnaea"" au sud du village, alt. 1680 m. Talus herbeux secs sur silice, en exposition sud.";;False;45.9482260259948 , 7.2091877460479745;;;;
B;Herbarium Berolinense;B100072261;8;8746725;CEPHALOTAXACEAE;CEPHALOTAXACEAE;sp.;;Türkei;;;;False;Muğla;;;False;22/06/1999 - 22/06/1999;;;M. Döring, G. Parolly & D. Tolimir;;;125;;D. Tolimir, Parolly;;;Darko Tolimir;False;Sandras Dağı, above Ağla, Akköprü Çöğenli (=saddle between Altınsivri and Çiçekbaba Tepesi). Rocky slope with boulders, coarse and fine scree. Alt. 1800 m. Ophiolite, serpentine.;;False;37.05 , 28.8;;;;
B;Herbarium Berolinense;B100111985;8;8746725;CEPHALOTAXACEAE;CEPHALOTAXACEAE;sp.;;Österreich;;;;False;Steiermark;;;False;09/09/1931 - 09/09/1931;;;Friedrich Morton;;;664;;;;True;;True;Loser, Aufst. v. Altausseer See. Von der Hütte zum Gipfel. Matte.;;False;47.65772814970516 , 13.776984214782715;;;;
B;Herbarium Berolinense;B100111987;8;8746725;CEPHALOTAXACEAE;CEPHALOTAXACEAE;sp.;;Österreich;;;;False;Oberösterreich;;;False;29/06/1948 - 29/06/1948;;;J. Pilz;;;4799;False;;;True;;True;Dachsteingebiet. Leislingwand;;False;47.650687 , 13.683629;;;;
B;Herbarium Berolinense;B100111988;8;8746725;CEPHALOTAXACEAE;CEPHALOTAXACEAE;sp.;;Österreich;;;;False;Oberösterreich;;;False;27/08/1949 - 27/08/1949;;;Friedrich Morton;;;5147;;;;True;;True;Dachsteingebiet, Leislingwand, J. Sabina-Standort.;;False;47.649767 , 13.683412;;;;
B;Herbarium Berolinense;B100113408;8;8746725;CEPHALOTAXACEAE;CEPHALOTAXACEAE;sp.;;Türkei;;;;False;Muğla;;;False;01/06/2002 - 30/06/2002;;;Özkan Eren;;;5186;;Özkan Eren;;;Özkan Eren;;"Babadag above Fethiye 1500-2000 m. Rocky slopes; on rocks, o screes; o thurn-cushion and dwarf-shrub communities; o dolines; o wind-swept cushion communities. Limestone.";;False;36.5379403266197 , 29.18449401855469;;;;
B;Herbarium Berolinense;B100113477;8;8746725;CEPHALOTAXACEAE;CEPHALOTAXACEAE;sp.;;Türkei;False;;;;Muğla;;;;01/06/2002 - 30/06/2002;False;False;Özkan Eren;;False;5186;False;Özkan Eren;;False;Özkan Eren;False;C3 Antalya, between Fethiye and Kalkan Pinus brutia forest, alt. c. 200 m.;False;;36.45736 , 29.255001;;;;
B;Herbarium Berolinense;B100113478;8;8746725;CEPHALOTAXACEAE;CEPHALOTAXACEAE;sp.;;Türkei;;;;False;Antalya;;;False;01/06/2002 - 30/06/2002;;;Özkan Eren;;;5198;;Özkan Eren;;;Özkan Eren;;C3 Antalya, between Fethiye and Kalkan Pinus brutia forest, alt. c. 200 m.;;False;36.27162453423435 , 29.406291769579628;;;;
B;Herbarium Berolinense;B100114544;8;8746725;CEPHALOTAXACEAE;CEPHALOTAXACEAE;sp.;;Türkei;;;;False;Antalya;;;False;01/06/2002 - 30/06/2002;;;Özkan Eren;;;5456;;Özkan Eren;;;Özkan Eren;;"Between Susuz Mountain and Kofu Mountain Bozkaya Tepe, 1400-2250 m. Rocky slopes; o on rocks; o screens; thurn-cushion and dwarf-shrub communities; o dolines; o wind-swept cushion communities. Limestone.";;False;36.495405 , 29.776327;;;;False
B;Herbarium Berolinense;B100118596;8;8746725;CEPHALOTAXACEAE;CEPHALOTAXACEAE;sp.;;Österreich;False;;;;Oberösterreich;;;False;27/08/1949 - 27/08/1949;False;False;Friedrich Morton;;False;5169;False;;;True;;True;Dachsteingebiet, Leislingwand, Junip-Sabina-Standort. mit Erigeron polymorphus und Thesium alpinum;;False;47.649767 , 13.683412;;;;
B;Herbarium Berolinense;B100128441;8;8746725;CEPHALOTAXACEAE;CEPHALOTAXACEAE;sp.;;Österreich;;;;False;Oberösterreich;;;False;12/10/1949 - 12/10/1949;;;J. Pilz;;;5251;;;;True;;True;Dachsteingebietes. Steinwand (Goisern);;False;47.638097 , 13.620369;;;;
B;Herbarium Berolinense;B100128442;8;8746725;CEPHALOTAXACEAE;CEPHALOTAXACEAE;sp.;;Österreich;False;;;;Steiermark;;;;20/06/1946 - 20/06/1946;False;False;Friedrich Morton;;False;;True;;;True;;True;Grimming 1300 m.;False;;47.51250999289558 , 14.02458429336548;;;;False
B;Herbarium Berolinense;B100128443;8;8746725;CEPHALOTAXACEAE;CEPHALOTAXACEAE;sp.;;Österreich;False;;;;Oberösterreich;;;;27/08/1949 - 27/08/1949;False;False;Friedrich Morton;;False;5171;False;;;True;;True;Dachsteingebiet, Leislingwand, Junip. Sabina - Standort;False;;47.64976661437681 , 13.683411595535887;;;;False
B;Herbarium Berolinense;B100132114;8;8746725;CEPHALOTAXACEAE;CEPHALOTAXACEAE;sp.;;Jemen;;;;False;Al Mahrah;;;False;14/11/2000 - 14/11/2000;;;Bruno Mies;;;1628;;P. Hein;;;Bruno Mies;;Jebel Hadaba, Ras Fartaq, near Nishtun.630-930m a.s.l., Expos. calcareous soil. Limestone plateau and slopes.;;False;15.833333333333334 , 51.983333333333334;;;;
B;Herbarium Berolinense;B100163202;8;8746725;CEPHALOTAXACEAE;CEPHALOTAXACEAE;sp.;;Zypern;;;;False;Pafos(Πάφος);;;False;30/03/1998 - 30/03/1998;;;R. Hand;;;2032;;R. Hand;;;Ralf Hand;;Division I (sensu Meikle 1977/1885). Tala gorge and slopes above chapel Agia Varvara, rocky slope, open woodland, alt. c. 250 m;;False;34.79657263821568 , 32.42855072021485;;;;
B;Herbarium Berolinense;B100173521;8;8746725;CEPHALOTAXACEAE;CEPHALOTAXACEAE;sp.;;Schweiz;;;;False;Graubünden(Grisons);;;False;09/09/2004 - 09/09/2004;;;Rost;;;Ro 43;;Th. Raus;;;;True;Oberengadin, Rätische Alpen, von Casaccia nach Soglio, 1400m;;False;46.36837267776887 , 9.659214019775392;;;;
B;Herbarium Berolinense;B100194329;8;8746725;CEPHALOTAXACEAE;CEPHALOTAXACEAE;sp.;;Deutschland;;;;False;Berlin;;;False;;;True;;;True;;True;;;True;Andrae;;Berlin;;False;52.5170365 , 13.3888599;;;;
B;Herbarium Berolinense;B100208536;8;8746725;CEPHALOTAXACEAE;CEPHALOTAXACEAE;sp.;;Türkei;;;;False;Antalya;;;False;12/07/2000 - 12/07/2000;;;Özkan Eren & Gerald Parolly;;;Parolly 7929;;Gerald Parolly;;;;True;"C4 Antalya: Akdağ (2461m), Gökbeli Yaylasi; alt. 1500-1670 m. Limestone and dolomite. Dolomite cliffs [c. 1500 m] with shady rock crock crevices, shady step crevices nitrophytic grottos and ""Balmen"", and sunny rocks; - o damp turf by a streamlet [1670 m]; - o thorn-cushion community with Aethionema alanyae [c. 1550 m].";;False;36.65523462645329 , 32.28092193603516;;;;
B;Herbarium Berolinense;B100259166;8;8746725;CEPHALOTAXACEAE;CEPHALOTAXACEAE;sp.;;Armenien;;;;False;Lori(Լոռի);;;False;30/06/2003 - 30/06/2003;;;George Fayvush, Kamilla Tamanyan, Hasmik Ter-Voskanian, Ernst Vitek;;;03-0427;;A. Nersesyan;;;Ernst Vitek;False;"area NNE of Stepanavan, Mt. Lalvar E of village Sverdlov, side valley leading to saddle between two peaks [14 05'14-30""N/44 25'32""-26'13""]; 1690-1900 m s.m.";;False;41.089444444444446 , 44.43111111111111;;;;
B;Herbarium Berolinense;B100276629;8;8746725;CEPHALOTAXACEAE;CEPHALOTAXACEAE;sp.;;Rumänien;;;;False;Braşov;;;False;11/08/1928 - 11/08/1928;;;O. Schwarz;;;125;;Anonymous (Mus. Bot. Berol);;;;True;"Burzenländer Karpathen: Königsteingebirge: im Krummholz in der oberen ""Crepatura"" ca. 1700 m. s. m.";;False;45.553015937661364 , 25.250101089477543;;;;
B;Herbarium Berolinense;B100276630;8;8746725;CEPHALOTAXACEAE;CEPHALOTAXACEAE;sp.;;Rumänien;;;;False;Prahova;;;;14/08/1928 - 14/08/1928;;;O. Schwarz;;;358;;L. Martins;;;;True;Burzenländer Karpathen: Bucsecs-Gebiet: Matten im oberen Jepi-Tal. 15-1900 m. s. m.;False;;45.387765 , 25.503525;;;;
B;Herbarium Berolinense;B101066350;8;8746725;TAXACEAE;Taxus;brevifolia;;Vereinigte Staaten von Amerika;;;;False;California;;;False;13/04/1965 - 13/04/1965;;;Bolander;;;4554;;;;True;G. Engelmann;;"""Devils Gulch near Forest Hill, Sierras"".";;False;37.604533 , -119.822464;;;;
B;Herbarium Berolinense;B101066351;8;8746725;TAXACEAE;Taxus;brevifolia;;Kanada;False;;;;British Columbia / Colombie Britanique;;;;14/06/1905 - 14/06/1905;False;False;Charles H. Shaw;;False;686;False;John Macrun;;False;;True;Selkirk. Base of Mt. at Lardo.;False;;50.368477 , -117.107468;;;;False
B;Herbarium Berolinense;B101066352;8;8746725;TAXACEAE;Taxus;brevifolia;;Deutschland;True;;;False;Brandenburg;;;False;01/01/1883 - 31/12/1883;;False;J. Bornmüller;;;;True;;;True;J. Bornmüller;;[Wildherkunft N. Am. [Nord Amerika]] Potsdam- cult.;;False;52.4009309 , 13.0591397;;;;
B;Herbarium Berolinense;B101066353;8;8746725;TAXACEAE;Taxus;brevifolia;;Deutschland;True;;;False;Berlin;;;False;13/08/1947 - 13/08/1947;;;;;True;;True;;;True;;True;Botanischer Garten Berlin-Dahlem angepflanzt;;False;;;;;True
B;Herbarium Berolinense;B101066354;8;8746725;TAXACEAE;Taxus;canadensis;;Vereinigte Staaten von Amerika;;;;False;New York;;;False;02/10/1998 - 02/10/1998;;;J. Silba;;;E-335;;;;True;John Silba;;Saratoga Springs, Skidmore College, woods east of Haupt Pond, in Acer saccharinum and Pinus (Pinus strobus) woods;;False;43.102564246484924 , -73.781596183253;;;;
B;Herbarium Berolinense;B101066355;8;8746725;TAXACEAE;Taxus;canadensis;;Vereinigte Staaten von Amerika;;;;False;New York;;;False;02/10/1998 - 02/10/1998;;;J. Silba;;;E-335;;;;True;John Silba;;Saratoga Springs, Skidmore College, woods east of Haupt Pond, a few small plants, in Acer saccharinum and Pinus strobus woods.;;False;43.102564 , -73.781596;;;;
B;Herbarium Berolinense;B101066356;8;8746725;TAXACEAE;Taxus;canadensis;;Vereinigte Staaten von Amerika;;;;False;Virginia;;;False;09/09/1942 - 09/09/1942;;;A. B. Massey;;;5067;;;;True;;True;On wooded bluff among limestone outcrop, above Tom's Creek at Sunnyside School house, 10 miles n. w. of Blacksburg, Montgomery County;;False;37.2238959353662 , -80.57870864868165;;;;
B;Herbarium Berolinense;B101066357;8;8746725;TAXACEAE;Taxus;canadensis;;Vereinigte Staaten von Amerika;;;;False;New York;;;False;28/08/1926 - 28/08/1926;;;Appel;;;62;False;;;True;Appel;;Taughannock falls - b.  Ithaca NY.;;False;42.53880971021127 , -76.60784204961045;;;;
B;Herbarium Berolinense;B101066358;8;8746725;TAXACEAE;Taxus;canadensis;;Vereinigte Staaten von Amerika;False;;;;Massachusetts;;;;31/05/1919 - 31/05/1919;False;False;Camillo Schneider;;False;;True;;;True;;True;shady woods on hills east of Lenox, Mass.;False;;42.35791282168615 , -73.25649261474611;;;;False
B;Herbarium Berolinense;B101066359;8;8746725;TAXACEAE;Taxus;canadensis;;Vereinigte Staaten von Amerika;False;;;;Wisconsin;;;;27/07/1922 - 27/07/1922;False;False;Huron H. Smith;;False;7729;False;;;True;;True;Southwestern Wisconsin. Grant County. Along the Platte River;;False;;;;;True
B;Herbarium Berolinense;B101066360;8;8746725;TAXACEAE;Taxus;canadensis;;Vereinigte Staaten von Amerika;;;;False;Wisconsin;;;False;05/09/1917 - 05/09/1917;;;M. J. Escoll;;;467;;;;True;;True;Lugerville, Price Co.;;False;45.7755146 , -90.5062657;;;;
B;Herbarium Berolinense;B101066361;8;8746725;TAXACEAE;Taxus;canadensis;;Vereinigte Staaten von Amerika;;;;False;Michigan;;;False;31/08/1935 - 31/08/1935;;;J. E. Potzger;;;6639;;;;True;;True;Cedar swamp along US 10, 1/2 mile west of Farwell, Clare County;;False;43.83688098435506 , -84.88861083984375;;;;
B;Herbarium Berolinense;B101066362;8;8746725;TAXACEAE;Taxus;canadensis;;Vereinigte Staaten von Amerika;False;;;;Maine;;;;15/08/1931 - 15/08/1931;False;False;R. C. Friesner;;False;3324;False;;;True;;True;1 mile N. Franklin. Wet northeast slope, densely wooded;False;;44.596652 , -68.228688;;;;False
B;Herbarium Berolinense;B101066363;8;8746725;TAXACEAE;Taxus;canadensis;;Vereinigte Staaten von Amerika;;;;False;Virginia;;;False;20/07/1892 - 20/07/1892;;;John K. Small;;;;True;;;True;;True;Middle Holston Valley. S. W. Virginia. Middle Fork of Holston River, six miles W. of Marion, Smyth County. Altitude, 2050 feet.;;False;36.823840415986545 , -81.56370162963869;;;;
B;Herbarium Berolinense;B101066364;8;8746725;TAXACEAE;Taxus;canadensis;;Vereinigte Staaten von Amerika;;;;False;North Carolina;;;False;10/08/1968 - 10/08/1968;;;S. W. Leonard, J. H. Hardin, Gladstone McDowell & party;;;2099;;;;True;;True;Ashe County. Under spruce and rhododendron along Long Hope Creek at the Ashe-Watauga County line on Richardson Farm, elev. 4200 ft.;;False;36.374554119406135 , -81.64086341857912;;;;
B;Herbarium Berolinense;B101066365;8;8746725;TAXACEAE;Taxus;canadensis;;Vereinigte Staaten von Amerika;;;;False;New York;;;False;01/08/1879 - 31/08/1879;;;G. E.;;;;True;;;True;;True;Goats Island, Niagary.;;False;43.081189 , -79.068851;;;;
B;Herbarium Berolinense;B101066366;8;8746725;TAXACEAE;Taxus;canadensis;;Vereinigte Staaten von Amerika;False;;;;New York;;;;17/08/1879 - 17/08/1879;False;False;G. E.;;False;;True;;;True;;True;Goat Island, Niagara;False;;43.0811887 , -79.06885146412493;;;;False
B;Herbarium Berolinense;B101066367;8;8746725;TAXACEAE;Taxus;canadensis;;Vereinigte Staaten von Amerika;;;;False;Maine;;;False;14/07/1886 - 14/07/1886;;;E. C. Smith;;;;True;H. Ern;;;;True;Augusta;;False;44.310545 , -69.7792759;;;;
B;Herbarium Berolinense;B101066368;8;8746725;TAXACEAE;Taxus;canadensis;;Kanada;;;;False;;;;True;;;True;Macoun;;;;True;;;True;Geo. Vasey;;Canada;;False;;;;;True
B;Herbarium Berolinense;B101066369;8;8746725;TAXACEAE;Taxus;canadensis;;Vereinigte Staaten von Amerika;False;;;;New Hampshire;;;;24/04/1904 - 24/04/1904;False;False;F. F. Forbes;;False;;True;H. Ern;;False;Gray;False;East Rindge Woods;False;;42.7279 , -72.1973;;;;False
B;Herbarium Berolinense;B101066370;8;8746725;TAXACEAE;Taxus;canadensis;;Polen;True;;;;Dolnośląskie;;;;23/04/1857 - 23/04/1857;False;False;F. Schwarzer;;False;1799;False;;;True;;True;Gräbersdorf [Udanin], im Garten.;False;;51.0375751 , 16.449276;;;;False
B;Herbarium Berolinense;B101066371;8;8746725;TAXACEAE;Taxus;chinensis;;China;;;;False;Sichuan(四川);;;False;03/07/1990 - 03/07/1990;;;Liu Zheng-yu;;;14704;False;;;True;;True;Nanchuan Co. alt. 650m;;False;29.1 , 107.0;;;;
B;Herbarium Berolinense;B101066372;8;8746725;TAXACEAE;Taxus;chinensis;;China;;;;False;Sichuan(四川);;;False;15/11/1946 - 15/11/1946;False;False;Wen-Kuang Hu;;False;8497;False;;;True;;True;Omei Hsien: Mount Omei [Emei];;False;29.51972222222222 , 103.3325;;;;
B;Herbarium Berolinense;B101066373;8;8746725;TAXACEAE;Taxus;chinensis;;China;;;;False;Guangdong(广东);;;False;02/11/1932 - 30/11/1932;False;False;Tsang, W. T.;;False;20694;False;E. D. Merrill;;False;;True;Kwangtung. Chong Uen Shan near Kau Fung (Loh Ch'ang District). Fairly common. Dry sandy soil.;;False;;;;;True
B;Herbarium Berolinense;B101066374;8;8746725;TAXACEAE;Taxus;chinensis;;China;;;;False;Sichuan(四川);;;False;01/01/1885 - 31/12/1888;;;Aug. Henry;;;7097;;Pilger;;;;True;Prov. Szechwan.;;False;;;;;True
B;Herbarium Berolinense;B101066375;8;8746725;TAXACEAE;Taxus;chinensis;;China;;;;False;Sichuan(四川);;;False;01/01/1885 - 31/12/1888;;;Aug. Henry;;;7155;;Pilger;;;;True;Prov. Szechwan.;;False;;;;;True
B;Herbarium Berolinense;B101066376;8;8746725;TAXACEAE;Taxus;chinensis;;China;;;;False;Sichuan(四川);;;False;01/01/1910 - 31/12/1911;False;False;E. H. Wilson;;False;4053;False;;;True;;True;Western Szechuan;;False;;;;;True
B;Herbarium Berolinense;B101066377;8;8746725;TAXACEAE;Taxus;chinensis;;Vietnam;;;;False;Hòa Bình;;;False;03/06/1995 - 03/06/1995;False;False;S. Ickert-Bond, R. Bond, Hiep, Phan Le Koc;;False;172;False;;;True;;True;district of Mai Châu, near Hmong village of Pa Co, 1200 m. broadleaf evergreen tropical forest, limestone-;;False;20.7388 , 104.8894;;;;
B;Herbarium Berolinense;B101066378;8;8746725;TAXACEAE;Taxus;chinensis var. mairei;;China;False;;;;Chongqing(重庆);;;False;05/08/1990 - 05/08/1990;False;False;Liu Zheng-yu;;False;12784;False;;;True;;True;Sichuan Prov. Nanchuan Co. Alt. 700 m.In mixed forests;;False;29.1 , 107.0;;;;False
B;Herbarium Berolinense;B101066379;8;8746725;TAXACEAE;Taxus;chinensis var. mairei;;China;;;;False;Jiangxi(江西);;;False;20/08/1996 - 20/08/1996;False;False;C. M. Tan;;False;9608117;False;C. M. Tan;;False;;True;"Luoxi, Wuning Xian, in forest, valley; Alt. 1000 m";;False;29.095405238196545 , 114.92507743940223;;;;False
B;Herbarium Berolinense;B101066380;8;8746725;TAXACEAE;Taxus;cuspidata;;Russland;;;;False;Sakhalin oblast(Сахалинская область);;;False;01/01/1859 - 31/12/1863;False;;Fr[iedrich] Schmidt;;;;True;Pilger;;;;True;Ins[ula] Sachalin;;False;;;;;True
B;Herbarium Berolinense;B101066381;8;8746725;TAXACEAE;Taxus;cuspidata;;Russland;;;;False;Primorski krai(Приморский край);;;False;08/06/1906 - 08/06/1906;;;N. A. Palczewski;;;;True;;;True;C. Baenitz,Bothe;;Mandschurica: Insel Askold bei Wladiwostok.;;False;42.7578906 , 132.3409005;;;;
B;Herbarium Berolinense;B101066382;8;8746725;TAXACEAE;Taxus;cuspidata;;Russland;;;;False;Sakhalin oblast(Сахалинская область);;;False;18/08/1989 - 18/08/1989;;;Ge. Krebs;;;2854;;;;True;Ge. Krebs;;Insel Sachalin. Ostküste, ca. 25km südl. von Makarov, lichter Nadelwald;;False;48.41605852038756 , 142.69738143958747;;;;
B;Herbarium Berolinense;B101066383;8;8746725;TAXACEAE;Taxus;cuspidata;;;;;;True;;;;True;;;True;;;True;;True;;;True;Karl Koch;;;;True;;;;;True
B;Herbarium Berolinense;B101066384;8;8746725;TAXACEAE;Taxus;cuspidata;;Russland;False;;;;Sakhalin oblast(Сахалинская область);;;;20/07/1985 - 20/07/1985;False;False;N. Shvedchikova;;;;True;;;True;;True;UdSSR. Курильские острова. О Кунашир. Хвойно-жироколиственный лес вдоль тропы из п. Алëхино к Горячему озери. [Kuril'skiye ostrova. O Kunashir. Khvoyno-zhirokolistvennyy les vdol' tropy iz p. Alekhino k Goryachemu ozeri. Kurilen. Über Kunaschir. Nadelwald mit fetten Blättern entlang des Weges vom Dorf Alekhino zum heißen See.];;False;43.909599 , 145.534394;;;;False
B;Herbarium Berolinense;B101066385;8;8746725;TAXACEAE;Taxus;cuspidata;;Japan;;;;False;;;;True;;;True;;;True;;True;;;True;Sehlmeyer;;Japonia.;;False;;;;;True
B;Herbarium Berolinense;B101066386;8;8746725;TAXACEAE;Taxus;cuspidata;;Japan;;;;False;Hokkaidō(北海道);;;False;01/10/1918 - 31/10/1918;;;M. Takenouchi;;;141;;;;True;M. Takenouchi;;Chambetsu, prov. Kushiro, Yezo.;False;False;43.20805555555556 , 144.6761111111111;;;;
B;Herbarium Berolinense;B101066387;8;8746725;TAXACEAE;Taxus;cuspidata;;China;;;;False;Gansu(甘肃);;;False;08/10/1914 - 08/10/1914;False;False;F. N. Meyer;;False;1790;False;;;True;;True;Fu orr yei, Province of Kansu;True;;;;;;True
B;Herbarium Berolinense;B101066388;8;8746725;TAXACEAE;Taxus;cuspidata;;Deutschland;True;;;False;Berlin;;;False;22/03/1994 - 22/03/1994;;;Cubr;;;32218;;H. Ern;;;;True;Botanischer Garten Berlin-Dahlem, Revier: AR-01--029;;False;52.456704527553406 , 13.305816650390627;;;;
